{
  "format": "holoui-sync-project",
  "version": 1,
  "kind": "menu",
  "subjectId": "main",
  "menus": [
    {
      "id": "main",
      "json": "{\"components\":[],\"followPlayer\":true}"
    }
  ],
  "images": [],
  "constraints": {
    "subjectId": "main",
    "menuIds": ["main"],
    "imagePaths": [],
    "newImagePrefix": "sync/menus/main/",
    "allowDeletes": false
  },
  "warnings": [],
  "baseRevision": "sha256:ec18b7610a5df4a0e172be9a5d8bec0b25c2927d84327908bd3f6c3e7a46d3cd"
}
